{
  "$schema": "https://json-schema.org/draft/2020-12/schema",
  "$id": "https://towerkit.dev/schema/program.schema.json",
  "title": "Insurance program placement",
  "type": "object",
  "additionalProperties": false,
  "required": ["insured", "program", "placement", "period", "lines", "layers", "retentions"],
  "properties": {
    "$schema": { "type": "string" },
    "insured": { "type": "string", "minLength": 1 },
    "program": { "type": "string", "minLength": 1 },
    "placement": { "enum": ["bound", "proposed"] },
    "period": {
      "type": "object",
      "additionalProperties": false,
      "required": ["start", "end"],
      "properties": {
        "start": { "type": "string", "format": "date" },
        "end": { "type": "string", "format": "date" }
      }
    },
    "currency": { "type": "string", "minLength": 3, "maxLength": 3 },
    "lines": {
      "type": "array",
      "items": { "$ref": "#/$defs/line" }
    },
    "layers": {
      "type": "array",
      "items": { "$ref": "#/$defs/layer" }
    },
    "retentions": {
      "type": "array",
      "items": { "$ref": "#/$defs/retention" }
    },
    "sublimits": {
      "type": "array",
      "items": { "$ref": "#/$defs/sublimit" }
    },
    "notes": { "type": "string" }
  },
  "$defs": {
    "money": {
      "description": "Integer whole dollars. Never a float.",
      "type": "integer",
      "minimum": 0
    },
    "share": {
      "description": "Decimal fraction of a layer, precise to the basis point (0.0001).",
      "type": "number",
      "minimum": 0,
      "maximum": 1
    },
    "line": {
      "type": "object",
      "additionalProperties": false,
      "required": ["id", "name"],
      "properties": {
        "id": { "type": "string", "minLength": 1 },
        "name": { "type": "string", "minLength": 1 },
        "abbr": { "type": "string", "minLength": 1 }
      }
    },
    "layer": {
      "type": "object",
      "additionalProperties": false,
      "required": ["id", "name", "appliesTo", "attach", "limit"],
      "properties": {
        "id": { "type": "string", "minLength": 1 },
        "name": { "type": "string", "minLength": 1 },
        "appliesTo": {
          "type": "array",
          "minItems": 1,
          "items": { "type": "string" }
        },
        "attach": { "$ref": "#/$defs/money" },
        "limit": {
          "description": "Integer dollars. Positivity is a semantic rule so drafts stay loadable.",
          "type": "integer"
        },
        "premium": { "$ref": "#/$defs/money" },
        "participants": {
          "type": "array",
          "items": { "$ref": "#/$defs/participant" }
        },
        "notes": { "type": "string" }
      }
    },
    "participant": {
      "type": "object",
      "additionalProperties": false,
      "required": ["carrier", "share"],
      "properties": {
        "carrier": { "type": "string", "minLength": 1 },
        "share": { "$ref": "#/$defs/share" }
      }
    },
    "retention": {
      "type": "object",
      "additionalProperties": false,
      "required": ["appliesTo", "type", "amount"],
      "properties": {
        "appliesTo": {
          "type": "array",
          "minItems": 1,
          "items": { "type": "string" }
        },
        "type": { "enum": ["deductible", "sir", "captive"] },
        "amount": { "$ref": "#/$defs/money" },
        "aggregate": { "$ref": "#/$defs/money" },
        "vehicle": { "type": "string", "minLength": 1 },
        "notes": { "type": "string" }
      }
    },
    "sublimit": {
      "type": "object",
      "additionalProperties": false,
      "required": ["name", "amount", "appliesTo"],
      "properties": {
        "name": { "type": "string", "minLength": 1 },
        "amount": { "$ref": "#/$defs/money" },
        "appliesTo": {
          "type": "array",
          "minItems": 1,
          "items": { "type": "string" }
        },
        "notes": { "type": "string" }
      }
    }
  }
}
